{
  "character": "slime",
  "style": "snes16",
  "scale": 1,
  "initial": "idle",
  "inputs": [
    "move",
    "stop",
    "attack"
  ],
  "onHit": {
    "light": "hurt",
    "heavy": "ko"
  },
  "states": {
    "idle": {
      "clip": "idle",
      "on": {
        "move": "walk",
        "attack": "attack"
      },
      "frames": [
        {
          "bdy": [
            {
              "x": 105,
              "y": 55,
              "w": 160,
              "h": 115
            }
          ],
          "push": {
            "x": 115,
            "y": 110,
            "w": 140,
            "h": 60
          }
        },
        {
          "bdy": [
            {
              "x": 105,
              "y": 55,
              "w": 160,
              "h": 115
            }
          ],
          "push": {
            "x": 115,
            "y": 110,
            "w": 140,
            "h": 60
          }
        },
        {
          "bdy": [
            {
              "x": 105,
              "y": 55,
              "w": 160,
              "h": 115
            }
          ],
          "push": {
            "x": 115,
            "y": 110,
            "w": 140,
            "h": 60
          }
        },
        {
          "bdy": [
            {
              "x": 105,
              "y": 55,
              "w": 160,
              "h": 115
            }
          ],
          "push": {
            "x": 115,
            "y": 110,
            "w": 140,
            "h": 60
          }
        }
      ]
    },
    "walk": {
      "clip": "walk",
      "on": {
        "stop": "idle",
        "attack": "attack"
      },
      "frames": [
        {
          "bdy": [
            {
              "x": 105,
              "y": 55,
              "w": 160,
              "h": 115
            }
          ],
          "push": {
            "x": 115,
            "y": 110,
            "w": 140,
            "h": 60
          }
        },
        {
          "bdy": [
            {
              "x": 105,
              "y": 55,
              "w": 160,
              "h": 115
            }
          ],
          "push": {
            "x": 115,
            "y": 110,
            "w": 140,
            "h": 60
          }
        },
        {
          "bdy": [
            {
              "x": 105,
              "y": 55,
              "w": 160,
              "h": 115
            }
          ],
          "push": {
            "x": 115,
            "y": 110,
            "w": 140,
            "h": 60
          }
        },
        {
          "bdy": [
            {
              "x": 105,
              "y": 55,
              "w": 160,
              "h": 115
            }
          ],
          "push": {
            "x": 115,
            "y": 110,
            "w": 140,
            "h": 60
          }
        },
        {
          "bdy": [
            {
              "x": 105,
              "y": 55,
              "w": 160,
              "h": 115
            }
          ],
          "push": {
            "x": 115,
            "y": 110,
            "w": 140,
            "h": 60
          }
        },
        {
          "bdy": [
            {
              "x": 105,
              "y": 55,
              "w": 160,
              "h": 115
            }
          ],
          "push": {
            "x": 115,
            "y": 110,
            "w": 140,
            "h": 60
          }
        }
      ]
    },
    "attack": {
      "clip": "attack",
      "next": "idle",
      "cancelFrom": 4,
      "on": {
        "attack": "attack"
      },
      "frames": [
        {
          "bdy": [
            {
              "x": 105,
              "y": 55,
              "w": 160,
              "h": 115
            }
          ],
          "push": {
            "x": 115,
            "y": 110,
            "w": 140,
            "h": 60
          }
        },
        {
          "bdy": [
            {
              "x": 105,
              "y": 55,
              "w": 160,
              "h": 115
            }
          ],
          "push": {
            "x": 115,
            "y": 110,
            "w": 140,
            "h": 60
          }
        },
        {
          "bdy": [
            {
              "x": 105,
              "y": 55,
              "w": 160,
              "h": 115
            }
          ],
          "itr": [
            {
              "kind": "hit",
              "box": {
                "x": 225,
                "y": 80,
                "w": 75,
                "h": 70
              },
              "damage": 5,
              "knock": {
                "dx": 15,
                "dy": -5
              },
              "stun": 6,
              "fall": 10,
              "effect": "dust"
            }
          ],
          "push": {
            "x": 115,
            "y": 110,
            "w": 140,
            "h": 60
          },
          "impulse": {
            "dx": 15,
            "dy": 0
          }
        },
        {
          "bdy": [
            {
              "x": 105,
              "y": 55,
              "w": 160,
              "h": 115
            }
          ],
          "itr": [
            {
              "kind": "hit",
              "box": {
                "x": 225,
                "y": 80,
                "w": 75,
                "h": 70
              },
              "damage": 5,
              "knock": {
                "dx": 15,
                "dy": -5
              },
              "stun": 6,
              "fall": 10,
              "effect": "dust"
            }
          ],
          "push": {
            "x": 115,
            "y": 110,
            "w": 140,
            "h": 60
          }
        },
        {
          "bdy": [
            {
              "x": 105,
              "y": 55,
              "w": 160,
              "h": 115
            }
          ],
          "push": {
            "x": 115,
            "y": 110,
            "w": 140,
            "h": 60
          }
        },
        {
          "bdy": [
            {
              "x": 105,
              "y": 55,
              "w": 160,
              "h": 115
            }
          ],
          "push": {
            "x": 115,
            "y": 110,
            "w": 140,
            "h": 60
          }
        }
      ]
    },
    "hurt": {
      "clip": "hurt",
      "next": "idle",
      "frames": [
        {
          "bdy": [
            {
              "x": 105,
              "y": 55,
              "w": 160,
              "h": 115
            }
          ],
          "push": {
            "x": 115,
            "y": 110,
            "w": 140,
            "h": 60
          },
          "impulse": {
            "dx": -15,
            "dy": 0
          }
        },
        {
          "bdy": [
            {
              "x": 105,
              "y": 55,
              "w": 160,
              "h": 115
            }
          ],
          "push": {
            "x": 115,
            "y": 110,
            "w": 140,
            "h": 60
          }
        },
        {
          "bdy": [
            {
              "x": 105,
              "y": 55,
              "w": 160,
              "h": 115
            }
          ],
          "push": {
            "x": 115,
            "y": 110,
            "w": 140,
            "h": 60
          }
        }
      ]
    },
    "ko": {
      "clip": "ko",
      "frames": [
        {
          "bdy": [
            {
              "x": 105,
              "y": 55,
              "w": 160,
              "h": 115
            }
          ],
          "push": {
            "x": 115,
            "y": 110,
            "w": 140,
            "h": 60
          },
          "impulse": {
            "dx": -25,
            "dy": -15
          }
        },
        {
          "bdy": [
            {
              "x": 105,
              "y": 55,
              "w": 160,
              "h": 115
            }
          ],
          "push": {
            "x": 115,
            "y": 110,
            "w": 140,
            "h": 60
          }
        },
        {
          "bdy": [
            {
              "x": 105,
              "y": 55,
              "w": 160,
              "h": 115
            }
          ],
          "push": {
            "x": 115,
            "y": 110,
            "w": 140,
            "h": 60
          }
        },
        {
          "bdy": [],
          "push": {
            "x": 115,
            "y": 110,
            "w": 140,
            "h": 60
          }
        },
        {
          "bdy": [],
          "push": {
            "x": 115,
            "y": 110,
            "w": 140,
            "h": 60
          }
        },
        {
          "bdy": [],
          "push": {
            "x": 115,
            "y": 110,
            "w": 140,
            "h": 60
          }
        }
      ]
    }
  }
}
